{
  "format": "scenity.asset/1",
  "id": "01M519A6TDANWND7RZRTTWR37V",
  "importer": "gltf",
  "kind": "model",
  "rights": "../../../rights/khronos-cc0.yaml",
  "settings": {},
  "source": "PointLightIntensityTest.glb",
  "tags": [
    "gltf-sample",
    "khr_lights_punctual",
    "khr_materials_unlit"
  ]
}
